{
  "kind": "concept",
  "density": "condensed",
  "tier": "creative",
  "domain": "travel",
  "candidate": "\u039c\u03ac\u03c1\u03ba\u03bf\u03c2 \u0397\u03bb\u03b9\u03ac\u03b4\u03b7\u03c2",
  "rank": "Tour Leader",
  "style": "Stamp Rally",
  "idea": "tickets, tags, stamps",
  "status": "proposed",
  "date": "2026-09-29",
  "producedBy": "magazine-editor",
  "contract": "cvgen.output/1",
  "pages": 1,
  "sha256": "7749d23ebe01674cf6558907c9c8951bee6eb7762d4ebecad9b773f5bfe221d4"
}
