{
  "kind": "house-design",
  "domain": "marine",
  "candidate": "Eleni Markou",
  "rank": "Chief Officer",
  "date": "2026-09-27",
  "producedBy": "magazine-editor",
  "style": "First Fitting",
  "status": "chosen",
  "idea": "the draft as a tailor's baste fitting",
  "source": "design-concepts/2026-09-27-first-fitting/concept.typ",
  "contract": "cvgen.output/1",
  "pages": 2,
  "sha256": "b22a7abd6c24999eadf51209510af0315663b31c4af833c87e6b851491d586f4"
}
