{
  "kind": "concept",
  "density": "spacious",
  "tier": "stylish",
  "domain": "travel",
  "candidate": "\u039c\u03ac\u03c1\u03ba\u03bf\u03c2 \u0397\u03bb\u03b9\u03ac\u03b4\u03b7\u03c2",
  "style": "Japan Passage",
  "idea": "crafted Japanese journeys",
  "status": "proposed",
  "producedBy": "magazine-editor",
  "date": "2026-10-02",
  "contract": "cvgen.output/1",
  "pages": 2,
  "sha256": "4d1d19b8ddd896c58894653c28760e8197dd88212dd7fe9f81b9a9cfc96aaa20"
}
