{
  "kind": "concept",
  "density": "condensed",
  "tier": "creative",
  "domain": "travel",
  "candidate": "\u039c\u03ac\u03c1\u03ba\u03bf\u03c2 \u0397\u03bb\u03b9\u03ac\u03b4\u03b7\u03c2",
  "rank": "Tour Leader",
  "style": "Woodblock Road",
  "idea": "woodblock travel print",
  "status": "proposed",
  "date": "2026-09-29",
  "producedBy": "magazine-editor",
  "contract": "cvgen.output/1",
  "pages": 1,
  "sha256": "2a189eeffba8d8af71ef37c18290e7cabba8bff8d73bcafc85b09b33fa596de7"
}
