{
  "kind": "concept",
  "density": "condensed",
  "tier": "safe",
  "domain": "travel",
  "candidate": "\u039c\u03ac\u03c1\u03ba\u03bf\u03c2 \u0397\u03bb\u03b9\u03ac\u03b4\u03b7\u03c2",
  "rank": "Tour Leader",
  "style": "Concourse",
  "idea": "Japanese station wayfinding",
  "status": "proposed",
  "date": "2026-09-29",
  "producedBy": "magazine-editor",
  "contract": "cvgen.output/1",
  "pages": 1,
  "sha256": "5b079bb9ffd49be73b344030ae34d53394f9176773c8dbffff844215afc93aca"
}
