{
  "kind": "concept",
  "density": "spacious",
  "tier": "stylish",
  "domain": "travel",
  "candidate": "\u039c\u03ac\u03c1\u03ba\u03bf\u03c2 \u0397\u03bb\u03b9\u03ac\u03b4\u03b7\u03c2",
  "rank": "Tour Leader",
  "style": "Stamp Rally",
  "idea": "tickets, tags, stamps",
  "status": "chosen",
  "date": "2026-09-29",
  "producedBy": "magazine-editor",
  "contract": "cvgen.output/1",
  "pages": 2,
  "sha256": "456d89932c9860f5273e1df219fbe997854bc04a05cbde8732cf1d4ac9fca18c"
}
