{
  "kind": "concept",
  "density": "spacious",
  "tier": "stylish",
  "domain": "travel",
  "candidate": "\u039c\u03ac\u03c1\u03ba\u03bf\u03c2 \u0397\u03bb\u03b9\u03ac\u03b4\u03b7\u03c2",
  "rank": "Tour Leader",
  "style": "Woodblock Road",
  "idea": "woodblock travel print",
  "status": "parked",
  "date": "2026-09-29",
  "producedBy": "magazine-editor",
  "contract": "cvgen.output/1",
  "pages": 2,
  "sha256": "1158ea09f42a20f45964efd9ad6e88f17210d3b286e048a9e28557a9044043f2"
}
