{
  "kind": "example",
  "domain": "marine",
  "source": "examples/marine/flagship/deck-cadet.typ",
  "candidate": "Nikos Petridis",
  "rank": "Deck Cadet",
  "status": "release",
  "style": "Flagship",
  "title": "Marine Deck Cadet CV One-page v01",
  "variant": "Golden Blue, one page",
  "producedBy": "scripts/build.ps1",
  "date": "2026-09-30",
  "contract": "cvgen.output/1",
  "pages": 1,
  "sha256": "28ae6396cd62f5dd8aded0a68168400b07244ceba75bce49f5b3e658004dea03"
}
