{
  "kind": "example",
  "domain": "marine",
  "source": "examples/marine/flagship/captain-silver.typ",
  "candidate": "Daniel Reed",
  "rank": "Master Mariner",
  "status": "release",
  "style": "Flagship",
  "title": "Marine Captain CV Silver v01",
  "variant": "Silver Bridge",
  "producedBy": "scripts/build.ps1",
  "date": "2026-09-30",
  "contract": "cvgen.output/1",
  "pages": 2,
  "sha256": "6bdd813f0e05cd0a32f8d22d9adf02efd02841ea573713b64d62a11e18cdf7ac"
}
