{
  "kind": "concept",
  "density": "spacious",
  "tier": "stylish",
  "domain": "travel",
  "candidate": "\u039c\u03ac\u03c1\u03ba\u03bf\u03c2 \u0397\u03bb\u03b9\u03ac\u03b4\u03b7\u03c2",
  "rank": "Tour Leader",
  "style": "Hanami Line 2",
  "idea": "travel, Japan, blossom",
  "status": "proposed",
  "producedBy": "magazine-editor",
  "date": "2026-10-02",
  "contract": "cvgen.output/1",
  "pages": 2,
  "sha256": "20d54fb0fc431fa4539666bc151317e2b96aa92c17921fc358c1f9599a3df9bd"
}
