{
  "kind": "example",
  "domain": "marine",
  "source": "examples/marine/flagship/engineer.typ",
  "candidate": "Alex Morgan",
  "rank": "Second Engineer",
  "status": "release",
  "style": "Flagship",
  "title": "Marine Engineer CV v12",
  "variant": "Golden Blue",
  "producedBy": "scripts/build.ps1",
  "date": "2026-09-30",
  "contract": "cvgen.output/1",
  "pages": 2,
  "sha256": "97681a75e95f1aa63d259eb9d173a922dd9e50a8f609778f0aaee2cca015669d"
}
