{
  "kind": "concept",
  "density": "spacious",
  "tier": "stylish",
  "domain": "travel",
  "candidate": "\u039c\u03ac\u03c1\u03ba\u03bf\u03c2 \u0397\u03bb\u03b9\u03ac\u03b4\u03b7\u03c2",
  "rank": "Tour Leader",
  "style": "Concourse",
  "idea": "Japanese station wayfinding",
  "status": "parked",
  "date": "2026-09-29",
  "producedBy": "magazine-editor",
  "contract": "cvgen.output/1",
  "pages": 2,
  "sha256": "275c164c65678300228b7ffa2b78b406965a7033177fe85a7a8a6984a4b61ca7"
}
