{
  "kind": "concept",
  "density": "condensed",
  "tier": "safe",
  "domain": "travel",
  "candidate": "\u039c\u03ac\u03c1\u03ba\u03bf\u03c2 \u0397\u03bb\u03b9\u03ac\u03b4\u03b7\u03c2",
  "rank": "Tour Leader",
  "style": "Stamp Rally",
  "idea": "tickets, tags, stamps",
  "status": "parked",
  "date": "2026-09-29",
  "producedBy": "magazine-editor",
  "contract": "cvgen.output/1",
  "pages": 1,
  "sha256": "ed503e9606b7c0554d81500201a0d6efa650445a263cd069b1214ef0b65f7f38"
}
